{
  "version": "1.0",
  "provenance": {"type": "conceptual", "summary": "Synthetic uncertainty example; not a reported experimental result."},
  "kind": "chart.line",
  "title": "Accuracy improves with additional training data",
  "caption": "Mean validation accuracy with 95% confidence interval",
  "view": {"type": "statistical-comparison", "audience": "academic"},
  "data": {
    "columns": {
      "samples": [100, 250, 500, 1000, 2000],
      "mean": [71.8, 75.6, 78.4, 81.1, 82.3],
      "low": [70.9, 74.8, 77.7, 80.5, 81.8],
      "high": [72.7, 76.4, 79.1, 81.7, 82.8]
    }
  },
  "series": [
    {
      "x": "samples",
      "y": "mean",
      "lower": "low",
      "upper": "high",
      "label": "Proposed method"
    }
  ],
  "semantics": {
    "x_label": "Training samples",
    "y_label": "Validation accuracy",
    "y_unit": "%",
    "uncertainty": "95% confidence interval, analytic"
  },
  "style": {"preset": "paper-light", "direct_labels": true},
  "layout": {"width_mm": 178, "aspect_ratio": 1.7},
  "output": {"primary": "svg", "additional": ["png"], "dpi": 300}
}
